Date received,Product,Sub-product,Issue,Sub-issue,Consumer complaint narrative,Company public response,Company,State,ZIP code,Tags,Consumer consent provided?,Submitted via,Date sent to company,Company response to consumer,Timely response?,Consumer disputed?,Complaint ID
8/30/2013,Bank account or service,Checking account,Deposits and withdrawals,,,,WELLS FARGO & COMPANY,MI,39206,"Older American, Servicemember",,Phone,9/17/2013,Closed with explanation,Yes,No,511036
2/26/2018,"Credit reporting, credit repair services, or other personal consumer reports",Credit reporting,Improper use of your report,Reporting company used your report improperly,"All three major credit bureaus ' have illegally hoarded consumers personal information without this Consumers expressed written consent. Pursuant to the 1974 Privacy Act,  all 3 credit bureaus ' violated all privacy rights and allowed personal information to be leaked, due to their false and misleading ways. According to the Fair Debt Collection Practices Act, all three credit bureaus ' maliciously and collectively shared this Consumers personal information to make trillions of dollars, by selling it to various debt collectors, employers, financial institutions and a host of others. My wish is for the Federal Trade Commission to demand, on my behalf, that all 3 credit bureaus ' remaove all of this Consumers social security numbers, date of births, financial accounts, or credit/debit card numbers, drivers license numbers, detailed health, or medical history, or similar sensitive information. All relations with these 3 credit bureaus ' are now in question for reporting fraudulant information to disgrace this Consumer. Consumer wishes for damages of XXXX XXXX dollars, from all 3 credit bureaus ' for their Treasonous deeds and all will be forgiven. Consumer would also like to thank the CFPB.",,"EQUIFAX, INC.",PA,171XX,,Consent provided,Web,2/26/2018,Closed with explanation,Yes,,2826358
2/8/2018,Credit card or prepaid card,General-purpose credit card or charge card,Problem with a purchase shown on your statement,Card was charged for something you did not purchase with the card,"Subject: RE: Credit Card Charge Disputed for XXXX Order XXXXGreetings,After examining the merchant and the amount on my credit card statement provided by Chase, I disputed a charge in the amount of $XXXX posted on XX/XX/2017 because neither I, nor anyone authorized, ordered, or signed for the merchandise. In addition, neither I nor anyone authorized received the merchandise represented by this transaction. I have been victimized and asked Chase to reissue a credit in the amount of $XXXX so wrongly incurred as soon as possible. I talked to someone on the phone previously from XXXX  and access to my account was restored after being locked out for three months due to the dispute.Chase position is that because the merchandise was billed to or shipped to your addressXXXX is claiming to have issued a refund and instructed to me to contact Chase. Chase is claiming that they have not received a refund and continues to bill the full amount plus interest and fees.If you have any questions or concerns, please do not hesitate to contact the undersigned. Thank you in advance for your time and assistance.XXXX",,JPMORGAN CHASE & CO.,MI,,Servicemember,Consent provided,Web,2/8/2018,Closed with explanation,Yes,,2808397
9/22/2018,Credit card or prepaid card,Store credit card,Fees or interest,Problem with fees,"XXXX credit card stop sending me monthly statements about my credit card more than a year ago and they started to charge me late fees of {$35.00} each month even though I was making monthly payment. 
when i opened the credit card with XXXX, I requested to receive the monthly paper statements only via postal mail. 
XXXX intentionally decided not to send me monthly paper statements so I will not know the due date and they can charge me late fees each month. 
XXXX knowingly engage in fraud by retain monthly statements in order to charge me late fees charges of {$35.00} each month. 
I have never authorized or agreed to receive monthly statement by any other mean than paper statements via postal mail. 

When realized that I was been charged monthly late fees for over a year, I asked Mr XXXX XXXX, the XXXX manager to remove all the late fees charges since I could not know when the monthly payment was due without a statement. He agreed that it was XXXX mistake and he could only refund XXXXne month out of more than twelve month. 
I told him that this was not a fair and satisfactory resolution for me and I decided to close my account with XXXX and told him that i will not paid the balance of {$940.00} until the fraudulent late fees are removed.",Company has responded to the consumer and the CFPB and chooses not to provide a public response,SYNCHRONY FINANCIAL,MD,208XX,,Consent provided,Web,9/22/2018,Closed with monetary relief,Yes,,3026675
9/10/2018,Mortgage,Conventional home mortgage,Trouble during payment process,,,Company believes it acted appropriately as authorized by contract or law,Ditech Financial LLC,VA,23139,,Consent not provided,Web,9/11/2018,Closed with explanation,Yes,,3015506
12/16/2013,Mortgage,Other mortgage,"Loan modification,collection,foreclosure",,,,OCWEN LOAN SERVICING LLC,GA,30022,,,Postal mail,12/19/2013,Closed with explanation,Yes,No,635861
2/4/2019,"Credit reporting, credit repair services, or other personal consumer reports",Credit reporting,Incorrect information on your report,Information belongs to someone else,,Company has responded to the consumer and the CFPB and chooses not to provide a public response,Experian Information Solutions Inc.,FL,338XX,,Other,Web,2/4/2019,Closed with non-monetary relief,Yes,,3142269
12/23/2014,Debt collection,Federal student loan,Improper contact or sharing of info,Contacted employer after asked not to,,,"National Enterprise Systems, Inc.",FL,335XX,,,Web,12/23/2014,Closed with explanation,Yes,Yes,1169035
11/29/2017,Debt collection,Federal student loan debt,False statements or representation,Attempted to collect wrong amount,"On XX/XX/XXXX I was reviewing my federal student loans, which are held by XXXX XXXX XXXX XXXX. I noticed that my interest rates had all increased - for instance, for my Direct Grad PLUS loan, my interest rates of 6.96 % had changed to 7.2 %. For my FFEL unsubsidized loan the interest rate had increased from 6.55 % to 6.96 % For my FFEL subsidized loan the interest rate increased from 5.35 to 5.59 %. The same can be said of my Direct loans, of which there are 10 tranches ( but I would be happy to outline the interest rates  and increases if needed ). 

On the same day, XX/XX/XXXX, I contacted my loan provider Great Lakes. I expressed my concern to the representative that my interest rates had increased at some point before XX/XX/XXXX and the last time I had checked my account, at the beginning of XX/XX/XXXX. The representative insisted that my loans were at a fixed-rate interest rate. I agreed, and said that the interest rates had increased regardless. She insisted this was not correct, but agreed to email me a copy of my original MPNs to indicate that the rates had not changed. 

After a day I had not received my MPNs from the loan provider. I found the MPNs myself through studentloans.gov and confirmed that the interest rates were what I had them documented as, instead of what Great Lakes was claiming them to be. I was going to call Great Lakes again, but I noticed online that the rates had been changed back to what they originally were supposed to be. 

I feel that Great Lakes is therefore exercising these practices with other people, who may not notice that their interest rates have increased. I 'm also fearful that they will try to increase the rates again, even though the loans are fixed-rate loans.",Company believes it acted appropriately as authorized by contract or law,GREAT LAKES,DC,200XX,,Consent provided,Web,11/29/2017,Closed with explanation,Yes,,2741598
3/12/2019,Mortgage,Conventional home mortgage,Struggling to pay mortgage,,,Company has responded to the consumer and the CFPB and chooses not to provide a public response,"FLAGSTAR BANK, FSB",NV,890XX,,Consent not provided,Web,3/12/2019,Closed with explanation,Yes,,3176832
1/30/2018,Vehicle loan or lease,Loan,Getting a loan or lease,Fraudulent loan,"Purchased a car from a dealer. Dealer did not pay the floor plan company for the car which made it difficult to get a tag for the car. Before the paper tag expired, the dealership closed down. While speaking with the finance company about the issue with the tag, I contacted the finance company to inquire about having to make payments on the car that I could not drive due to no legal tag. During this conversation, I asked the Director of the company ( XXXX XXXX ) if they could void the contract since there seemed to be some fraudulent activity going on. He told me that was not possible. After 5 months of not being able to drive the car due to no tag, the DMV was finally able to provide me with a tag. The 5 months that the car was parked, my wife & I still made our payments faithfully & on time. XX/XX/2018 we began the process to purchase a home & hired a certified credit consultant. Once our credit was pulled & the car showed up on the credit, our credit consultant asked to see the contract for the car. Due to the dealership advising us that the finance company would send the paperwork ( contract )  in the mail once they received the package & we never received it, we made contact with the finance company to request a copy of the contract. Once receipt of the contract, I noticed there was information that was not true & information that I did not have knowledge of. There was indications that I traded a car for this car ( but I did not ). As well as indication that the finance company of my first car would be paid off ( but it was not ). The down payment amount was not correct. The contract showed a down payment of {$1000.00} when in fact we put {$1200.00} down. There was nothing in the contract about GAP insurance but the dealer told us that part of the down payment would be used to purchase GAP coverage. After looking over the contract we then reached out to the finance company again to inform them of our findings. The rep we spoke with ( XXXX XXXX ) stated that he needed to pass the information along to someone above him and he would have someone from the finance or funding department to contact us. We did not hear from them on the day he promised so we initiated contacted again. At this time we were placed on hold & were told the department we needed to speak with was on another call & would be with us shortly. After holding for 5 mins, XXXX came to the line asking if anyone had contacted us and once told no he stated he would go to the person that was to contact us & make them aware that we were waiting to hear from them. After speaking with XXXX, we then decided to email him. This email informed the company that they seemed unsure about how to handle such a issue therefore, we thought it may help if we told them what we wanted to happen due to this fraudulent contract. We let it be known that we wanted out of the contract with no negative remarks on our credit, we wanted all payments made returned and we wanted them to retrieve their car. 2 hours later we received a email from XXXX XXXX with her direct phone # and asking that I contact her at our convenience. Shortly after receiving the email I called XXXX with my wife there with me and listening to the entire cal. XXXX asked that we start from the beginning with the issue of the loan. I told her about the issue with not having a tag and not being able to drive the car for the first 5 months. She was informed that I tried to see if the dealer had reopened before contacting them. I confirmed there was no car traded in, I informed her the down payment amount on the contract was incorrect and she was also informed that the car that the dealer said was traded is not a car that we own. She asked if the dealer told us to lie to them during the welcome call about the down payment amount and we told her no. We explained that the dealer advised us that the down payment amount that would be stated in the welcome call was because of the way the dealer was going to split the down payment up among the GAP coverage and warranty. XXXX stated 3-4 different times during the call that the contract was definitely fraud. Her exact words each time was "" oh, yes maam, this is definitely fraud on their end ''. The call ended by XXXX saying she needed to speak with her manager, let them know what we wanted and she promised to get back with us the nest day. As XXXX did contact me back the next day, she then changed from what she said the previous day and said there was no fraud. When asked why she was no changing what she said from the previous call, she denied ever saying that she admitted the contract was fraudulent and then asked why I kept bringing up yesterdays conversation. Once I realized she seemed to be doing just as dirty as the dealership, I then let her know that the company could keep the money that had been paid on the car but I wanted out of the contract because doing business with their company has been nothing but a headache. We ended the call by XXXX saying she would pass the information of me wanting out of the contract with no negative remarks on my credit even if there was no refund of payments to her manager and "" if he would like '', he would contact me. 
XXXX was representing the finance company and stated herself the contract was fraudulent but then after she spoke with other people in the company, she denied ever saying that. Then stated that I was asked about having another car during a welcome call but no we were not.",,"Coastal Credit, LLC",SC,293XX,,Consent provided,Web,1/30/2018,Closed with explanation,Yes,,2798234
11/15/2017,"Credit reporting, credit repair services, or other personal consumer reports",Credit reporting,Incorrect information on your report,Account status incorrect,,Company believes it acted appropriately as authorized by contract or law,ERC,NC,287XX,,Consent not provided,Web,11/15/2017,Closed with explanation,Yes,,2729535
7/14/2016,Credit card,,Transaction issue,,,,AMERICAN EXPRESS COMPANY,CA,91744,,Consent not provided,Web,7/14/2016,Closed with non-monetary relief,Yes,No,2010545
1/15/2015,Debt collection,"Other (i.e. phone, health club, etc.)",Cont'd attempts collect debt not owed,Debt is not mine,,,AFNI INC.,FL,32765,Older American,,Web,1/15/2015,Closed with explanation,Yes,No,1195401
2/4/2017,Credit card,,Delinquent account,,,,CAPITAL ONE FINANCIAL CORPORATION,TX,76132,,Consent not provided,Web,2/8/2017,Closed with explanation,Yes,Yes,2327402
1/1/2019,Debt collection,Credit card debt,Attempts to collect debt not owed,Debt was result of identity theft,"Ran my credit for the first time via XXXX XXXX.. Noticed charges I am not in anyway familiar with per credit agencies listed below. I would like to have these items of concern rectified and cleared from credit profile. 

Please see the following.

( 1 ) - XXXX XXXX XXXX XXXX states that I owe {$2100.00}. I know nothing of these charges and would like for this to be rectified and cleared from my credit score account.

( 2 ) - Capital One : {$560.00} Anything you can do will be greatly appreciated. 

Mr. XXXX XXXX.",,CAPITAL ONE FINANCIAL CORPORATION,CA,907XX,,Consent provided,Web,1/1/2019,Closed with explanation,Yes,,3114084
2/19/2018,"Credit reporting, credit repair services, or other personal consumer reports",Credit reporting,Incorrect information on your report,Account status incorrect,"I am reaching out regarding predatory practices on behalf of the company XXXX XXXX that seek to damage my credit. With the exemption of XXXX in which account XXXX XXXX # XXXX is removed, this said account has been charged off and closed. Additionally, XXXX and Experian report this account as closed in XX/XX/XXXX, XX/XX/XXXX, and XX/XX/XXXX. The lender ( XXXX XXXX ) is attempting to ILLEGALLY re-age a closed, charged off account. According to the FCRA, the beginning, first date of delinquency can not be changed once an account is charged off. Once a charged off account reaches 7 years, then the credit bureaus must purge the account from your credit history. XXXX XXXX has ILLEGALLY re-opened the account in an attempt to reset the 7 year clock. It is illegal for a creditor to change the purge from date on a negative account by reopening the account so that it remains on the consumer credit report. 

In light of the lack ethical practices on behalf of XXXX XXXX, incorrect payment history, incorrect account status, I am requesting that this account is REMOVED from my credit reports immediately. I have disputed this account several times and both XXXX and Experian have failed to adequately investigate my dispute after verifying these accounts which I know are inaccurate. The lender is attempting to illegally re-age the account. Consumers have the right to be protected from unfair credit practices ; hence I am requesting reparations by the account being removed. Please remove as soon as possible to avoid further damage to my credit and my reputation with creditors. Thank you again for your time. XXXX XXXX",Company has responded to the consumer and the CFPB and chooses not to provide a public response,Experian Information Solutions Inc.,NY,112XX,,Consent provided,Web,2/19/2018,Closed with explanation,Yes,,2818676
11/16/2017,Debt collection,Credit card debt,Communication tactics,Frequent or repeated calls,"Over the last 3 weeks, I have received a minimum 8 phones calls per day from Bank of America concerning "" pressing business matters. '' Typically, I receive a phone call, then within 10 minutes I receive a second phone call. Within a few hours, this process repeats itself. I have contacted Bank of America and discussed the issue and was advised that until my account was up to-to-date I would continue to receive the phone calls. I explained that I was receiving several phone calls per day and that I considered it harassment but was informed that this would continue until i made a payment on my account. I advised the customer service representative that all of my accounts were up to date and they apologized after some quick research. I was further informed at that time that they would ensure that the phone calls would stop and that they had submitted a "" call stop '' on my phone number. I was also informed that since I requested a "" Call Stop '' that I would not receive any phones calls regarding any of our 5 accounts. However, within 30 minutes, I received yet another phone call from Bank of America concerning a "" pressing business matter. '' I did speak with a third manager ( XXXX XXXX ), who as very kind, understanding and listened with intent. She informed me that she could not see where Bank of America had made any outbound calls to my number. The only thing she could see were 2 call backs. This is simply not true. ( 1 ) I receive, at minimum, 8 calls per day, ( 2 ) both times that I spoke with Customer Service Representative and Managers, I did so by staying online until I actually got to speak to a human being. Unfortunately, there is nothing that XXXX XXXX can truly due. I 'm certain I will receive yet another call within 10 minutes of hanging up with her.",Company has responded to the consumer and the CFPB and chooses not to provide a public response,"BANK OF AMERICA, NATIONAL ASSOCIATION",TN,379XX,Servicemember,Consent provided,Web,11/17/2017,Closed with non-monetary relief,Yes,,2731638
7/14/2017,Student loan,Federal student loan servicing,Dealing with your lender or servicer,Problem with customer service,"Got a call from my Mortgage company on Tuesday, XXXX XXXX, 2017 at XXXX. They were surprised on why Navient reported a deliquesce on my student loan account, for it being 4 months past due. They were surprised because in XXXX of 2017, when applying for my mortgage, they pulled my credit and I was, at that time, listed as "" in good standing '' with Navient. My first question is how do you go from being in good standing to being delinquent for 4 months in two months! The math does n't add up, there has to be a mistake. <P/>After receiving the call on Tuesday, XXXX XXXX, 2017 at XXXX, I quickly called Navient to settle the issue. I paid the past due payments, bringing my account to paid in full. They took the money out of my account on Tuesday as well. I called everyday since Tuesday, ( Wednesday at XXXX XXXX, Thursday at XXXX and at XXXX XXXX ) and finally on Wednesday night they processed the payment, even though they had already charged my account. I have asked everyday for them to send a notice to the Credit Bureau stating that my account was now paid in full, is current, and is in good standing, so that my credit score could get back to it 's previous score. As of right now, the response that I keep on getting from their customer service reps is that they can not send a notice until the end of the month. That does not work for me, because if that is the way it works, I will lose my house. My current credit score will not allow me to be granted the already pre-approved mortgage to pay for the house.",,"Navient Solutions, LLC.",OH,441XX,,Consent provided,Web,7/14/2017,Closed with explanation,Yes,,2575394
3/1/2017,Mortgage,Conventional fixed mortgage,"Loan servicing, payments, escrow account",,"Ocwen send me a notice that i need to send {$1200.00} for escrow which I did to keep my payment at XXXX per month, then they sent me a new payment of XXXX per month when i asked them way the increase they had no answer. This is my second time filing against this company, why they are still alowed to contunie in business I call XXXX in XXXX to bring this company",,OCWEN LOAN SERVICING LLC,NY,117XX,Older American,Consent provided,Web,3/1/2017,Closed with explanation,Yes,Yes,2365727
12/6/2017,Debt collection,Medical debt,Attempts to collect debt not owed,Debt is not yours,This debt is n't even mine and needs to be removed immediately. I was told via phone with original company I was not liable anymore for this as it was paid for. Please remove this for my credit report.,Company disputes the facts presented in the complaint,United Revenue Corporation,MT,,Servicemember,Consent provided,Web,12/6/2017,Closed with explanation,Yes,,2747418
2/29/2016,Debt collection,I do not know,Cont'd attempts collect debt not owed,Debt is not mine,,,GRYPHON CORP.,MN,558XX,,Consent not provided,Web,3/2/2016,Closed with explanation,Yes,Yes,1809425
6/27/2016,Debt collection,Mortgage,Cont'd attempts collect debt not owed,Debt is not mine,,Company has responded to the consumer and the CFPB and chooses not to provide a public response,"BANK OF AMERICA, NATIONAL ASSOCIATION",MA,02302,,Consent not provided,Web,6/27/2016,Closed with non-monetary relief,Yes,No,1986946
3/29/2019,"Credit reporting, credit repair services, or other personal consumer reports",Credit reporting,Incorrect information on your report,Account status incorrect,,,CAPITAL ONE FINANCIAL CORPORATION,MO,,,,Web,4/3/2019,Closed with explanation,Yes,,3194865
10/23/2015,Credit reporting,,Credit reporting company's investigation,Problem with statement of dispute,"Equifax began reporting a judgment on my credit report XX/XX/2015. I disputed this and received a copy of an unsigned unfiled judgment. An unsigned unfiled judgment is not a legally binding judgment. Equifax states that I did not respond within the 30 day period but this is incorrect as I was not notified by Equifax of the need to respond. 

I am continuing to dispute this judgment on my credit report. Please provide me with a copy of a judgment signed by a judge with an actual court filing date listed on it or remove this judgment from my credit report immediately. Prove this judgment is what you say it is or remove it. 

I have attached a copy of the purported judgement. It bears no judicial signature, no filing date, and there is no indication who signed it or otherwise. Please provide a copy of the legal document you are reporting or remove it.",,"EQUIFAX, INC.",MT,,,Consent provided,Web,10/23/2015,Closed with explanation,Yes,No,1621225
